{
  "architectural_decisions": [
    {
      "alternatives_considered": [
        "JSONB database integration",
        "Redis-based memory",
        "SQLite local storage"
      ],
      "decided_by": [
        "user",
        "claude"
      ],
      "decision": "Use JSON files for local agent memory storage instead of database integration",
      "decision_date": "2025-01-15T00:00:00Z",
      "decision_id": "json_memory_system",
      "impact_areas": [
        "agent_performance",
        "system_complexity",
        "maintenance"
      ],
      "rationale": "Simplified implementation, reduced complexity, easier maintenance while maintaining effectiveness",
      "review_date": "2025-03-15T00:00:00Z",
      "title": "JSON File-Based Agent Memory System"
    },
    {
      "alternatives_considered": [
        "Database storage",
        "Redis storage"
      ],
      "decided_by": [
        "test-suite"
      ],
      "decision": "Use JSON for agent memory storage",
      "decision_date": "2025-08-15T14:27:10.169234Z",
      "decision_id": "3760eaff-f076-4eff-8073-8456ea058f26",
      "impact_areas": [
        "performance",
        "maintenance"
      ],
      "implementation_progress": {},
      "lessons_learned": [],
      "rationale": "Simplicity and maintainability",
      "review_date": "2025-11-13T14:27:10.169239Z",
      "status": "active",
      "title": "Test Decision"
    },
    {
      "alternatives_considered": [
        "Database storage",
        "Redis storage"
      ],
      "decided_by": [
        "test-suite"
      ],
      "decision": "Use JSON for agent memory storage",
      "decision_date": "2025-08-15T15:07:00.513748Z",
      "decision_id": "0d3abc50-ecb5-43c3-b36d-bbcab14f6fe9",
      "impact_areas": [
        "performance",
        "maintenance"
      ],
      "implementation_progress": {},
      "lessons_learned": [],
      "rationale": "Simplicity and maintainability",
      "review_date": "2025-11-13T15:07:00.513753Z",
      "status": "active",
      "title": "Test Decision"
    },
    {
      "alternatives_considered": [
        "Database storage",
        "Redis storage"
      ],
      "decided_by": [
        "test-suite"
      ],
      "decision": "Use JSON for agent memory storage",
      "decision_date": "2025-08-15T15:08:53.615752Z",
      "decision_id": "bcf04880-0af3-4eed-9d7e-938fca54a7cf",
      "impact_areas": [
        "performance",
        "maintenance"
      ],
      "implementation_progress": {},
      "lessons_learned": [],
      "rationale": "Simplicity and maintainability",
      "review_date": "2025-11-13T15:08:53.615756Z",
      "status": "active",
      "title": "Test Decision"
    },
    {
      "alternatives_considered": [
        "Database storage",
        "Redis storage"
      ],
      "decided_by": [
        "test-suite"
      ],
      "decision": "Use JSON for agent memory storage",
      "decision_date": "2025-08-15T15:11:10.015476Z",
      "decision_id": "8bd6e403-7e60-4eee-ade1-70364d50331a",
      "impact_areas": [
        "performance",
        "maintenance"
      ],
      "implementation_progress": {},
      "lessons_learned": [],
      "rationale": "Simplicity and maintainability",
      "review_date": "2025-11-13T15:11:10.015478Z",
      "status": "active",
      "title": "Test Decision"
    },
    {
      "alternatives_considered": [
        "Database storage",
        "Redis storage"
      ],
      "decided_by": [
        "test-suite"
      ],
      "decision": "Use JSON for agent memory storage",
      "decision_date": "2025-08-15T15:17:39.505574+00:00Z",
      "decision_id": "548b9734-e375-4f08-bcc9-027396c38835",
      "impact_areas": [
        "performance",
        "maintenance"
      ],
      "implementation_progress": {},
      "lessons_learned": [],
      "rationale": "Simplicity and maintainability",
      "review_date": "2025-11-13T15:17:39.505576+00:00Z",
      "status": "active",
      "title": "Test Decision"
    },
    {
      "alternatives_considered": [
        "Database storage",
        "Redis storage"
      ],
      "decided_by": [
        "test-suite"
      ],
      "decision": "Use JSON for agent memory storage",
      "decision_date": "2025-08-15T15:18:25.875259+00:00Z",
      "decision_id": "2c4f5a6f-042e-484a-9f58-0b19caacdc6f",
      "impact_areas": [
        "performance",
        "maintenance"
      ],
      "implementation_progress": {},
      "lessons_learned": [],
      "rationale": "Simplicity and maintainability",
      "review_date": "2025-11-13T15:18:25.875262+00:00Z",
      "status": "active",
      "title": "Test Decision"
    },
    {
      "alternatives_considered": [
        "Database storage",
        "Redis storage"
      ],
      "decided_by": [
        "test-suite"
      ],
      "decision": "Use JSON for agent memory storage",
      "decision_date": "2025-08-15T15:18:48.376801+00:00Z",
      "decision_id": "9e6147ce-b2b6-4680-8141-bd42638f12e5",
      "impact_areas": [
        "performance",
        "maintenance"
      ],
      "implementation_progress": {},
      "lessons_learned": [],
      "rationale": "Simplicity and maintainability",
      "review_date": "2025-11-13T15:18:48.376803+00:00Z",
      "status": "active",
      "title": "Test Decision"
    },
    {
      "alternatives_considered": [
        "Database storage",
        "Redis storage"
      ],
      "decided_by": [
        "test-suite"
      ],
      "decision": "Use JSON for agent memory storage",
      "decision_date": "2025-08-15T15:20:16.900042+00:00Z",
      "decision_id": "e97986fd-40f4-4f2d-a8cc-2cfde91435bf",
      "impact_areas": [
        "performance",
        "maintenance"
      ],
      "implementation_progress": {},
      "lessons_learned": [],
      "rationale": "Simplicity and maintainability",
      "review_date": "2025-11-13T15:20:16.900049+00:00Z",
      "status": "active",
      "title": "Test Decision"
    },
    {
      "alternatives_considered": [
        "Database storage",
        "Redis storage"
      ],
      "decided_by": [
        "test-suite"
      ],
      "decision": "Use JSON for agent memory storage",
      "decision_date": "2025-08-15T17:09:29.776183+00:00Z",
      "decision_id": "1a3d2d39-697f-4a34-8649-0f1944c2d700",
      "impact_areas": [
        "performance",
        "maintenance"
      ],
      "implementation_progress": {},
      "lessons_learned": [],
      "rationale": "Simplicity and maintainability",
      "review_date": "2025-11-13T17:09:29.776185+00:00Z",
      "status": "active",
      "title": "Test Decision"
    },
    {
      "alternatives_considered": [
        "Database storage",
        "Redis storage"
      ],
      "decided_by": [
        "test-suite"
      ],
      "decision": "Use JSON for agent memory storage",
      "decision_date": "2025-08-15T17:11:03.673371+00:00Z",
      "decision_id": "cbe59bf5-159f-4608-ac21-d46f1048a741",
      "impact_areas": [
        "performance",
        "maintenance"
      ],
      "implementation_progress": {},
      "lessons_learned": [],
      "rationale": "Simplicity and maintainability",
      "review_date": "2025-11-13T17:11:03.673375+00:00Z",
      "status": "active",
      "title": "Test Decision"
    }
  ],
  "context_evolution": {
    "evolution_results": {
      "collaboration_improvements": [],
      "knowledge_synthesis": [],
      "optimization_opportunities": [],
      "pattern_discoveries": [],
      "risk_assessments": []
    },
    "last_evolution": "2025-08-15T17:11:03.724465+00:00Z"
  },
  "global_insights": [
    {
      "category": "performance",
      "confidence": 0.95,
      "contributing_agents": [
        "performance-engineer",
        "database-specialist"
      ],
      "created_at": "2025-01-15T00:00:00Z",
      "impact_assessment": "high",
      "insight": "Multi-level caching architecture (L1/L2/L3) achieved 96.67% hit rates with <2ms critical path response times",
      "insight_id": "performance_optimization_2025",
      "last_validated": "2025-01-15T00:00:00Z"
    },
    {
      "category": "architecture",
      "confidence": 0.98,
      "contributing_agents": [
        "ml-orchestrator",
        "database-specialist",
        "performance-engineer"
      ],
      "created_at": "2025-01-15T00:00:00Z",
      "impact_assessment": "high",
      "insight": "God object decomposition strategy successfully reduced complexity: 1,043-line MLPipelineOrchestrator \u2192 5 focused services <400 lines each",
      "insight_id": "architecture_modernization_2025",
      "last_validated": "2025-01-15T00:00:00Z"
    },
    {
      "category": "performance",
      "challenges": [],
      "confidence": 0.95,
      "contributing_agents": [
        "database-specialist",
        "ml-orchestrator",
        "performance-engineer"
      ],
      "created_at": "2025-08-15T14:19:01.189280Z",
      "evidence": [],
      "evolution_history": [],
      "impact_assessment": "high",
      "insight": "Agent memory system achieving 100% workflow success with 4.0 insights per workflow",
      "insight_id": "e28351b6-1429-4416-8af1-8510095da38e",
      "last_validated": "2025-08-15T14:19:01.189288Z",
      "validation_count": 0
    },
    {
      "category": "performance",
      "challenges": [],
      "confidence": 0.9,
      "contributing_agents": [
        "database-specialist",
        "performance-engineer"
      ],
      "created_at": "2025-08-15T14:27:10.154010Z",
      "evidence": [],
      "evolution_history": [],
      "impact_assessment": "high",
      "insight": "Test global insight",
      "insight_id": "ba34b0b5-3f8a-467b-a00a-ae1c3b2aff0e",
      "last_validated": "2025-08-15T14:27:10.154015Z",
      "validation_count": 0
    },
    {
      "category": "performance",
      "challenges": [],
      "confidence": 0.9,
      "contributing_agents": [
        "database-specialist",
        "performance-engineer"
      ],
      "created_at": "2025-08-15T15:07:00.493880Z",
      "evidence": [],
      "evolution_history": [],